{
  "policyId": "POL-500123",
  "policyNumber": "TC-2026-001",
  "policyHolderName": "Your Company SAS",
  "policyType": "trade_credit",
  "policyStatus": "active",
  "currency": "EUR",
  "maxCoverageAmount": 5000000.0,
  "coveragePercentage": 90,
  "startDate": "2026-01-01",
  "endDate": "2026-12-31",
  "country": "FR",
  "createdAt": "2025-12-01T10:00:00Z"
}